<?xml version="1.0" encoding="UTF-8"?>
<RCMR_IN030000UK06 xmlns="urn:hl7-org:v3" xmlns:xsi="http://www.w3.org/2001/XMLSchema-instance"
                   xsi:schemaLocation="urn:hl7-org:v3 ..\Schemas\RCMR_IN030000UK06.xsd">
    <id root="394559384658936"/>
    <creationTime value="20200218170946"/>
    <versionCode code="V3NPfIT3.1.10"/>
    <interactionId root="2.16.840.1.113883.2.1.3.2.4.12" extension="RCMR_IN030000UK06"/>
    <processingCode code="P"/>
    <processingModeCode code="T"/>
    <acceptAckCode code="NE"/>
    <communicationFunctionRcv typeCode="RCV">
        <device classCode="DEV" determinerCode="INSTANCE">
            <id root="1.2.826.0.1285.0.2.0.107" extension="from-asid-value"/>
        </device>
    </communicationFunctionRcv>
    <communicationFunctionSnd typeCode="SND">
        <device classCode="DEV" determinerCode="INSTANCE">
            <id root="1.2.826.0.1285.0.2.0.107" extension="to-asid-value"/>
        </device>
    </communicationFunctionSnd>
    <ControlActEvent classCode="CACT" moodCode="EVN">
        <author1 typeCode="AUT">
            <AgentSystemSDS classCode="AGNT">
                <agentSystemSDS classCode="DEV" determinerCode="INSTANCE">
                    <id root="1.2.826.0.1285.0.2.0.107" extension="to-asid-value"/>
                </agentSystemSDS>
            </AgentSystemSDS>
        </author1>
        <subject typeCode="SUBJ" contextConductionInd="false">
            <EhrExtract classCode="EXTRACT" moodCode="EVN">
                <id root="12345"/>
            </EhrExtract>
        </subject>
    </ControlActEvent>
</RCMR_IN030000UK06>